ref_consultation,org_acronyme,reference,type_procedure,type_procedure_abbrev,categorie,objet,acheteur,lieu_execution,date_publication,date_limite,statut,url,est_annule,resultat_definitif,nombre_lots,estimation_totale_ttc
966131,f9f,02/2025/CTA,Appel d'offres ouvert,AOO,Travaux,Aménagement des points d’eau : AFLA N’TAKOUCHE – TAGUNITE– TALMA – MEGUEN – TOURITE N’MEGUEN – AIT AISSA – ANAMER ISSAGUEN – en système de pompage solaire. Commune AOUGUENZ province CHTOUKA AIT BAHA.,Commune AOUGUENZ,CHTOUKA-AIT BAHA,2025-12-25,2026-01-21 10:00:00,,https://www.marchespublics.gov.ma/index.php?page=entreprise.EntrepriseDetailConsultation&refConsultation=966131&orgAcronyme=f9f,False,False,1,802680.0
966153,p8x,5/DPB/2026,Consultation architecturale ouverte,CONSA,Services,LES ETUDES ARCHITECTURALES ET LE SUIVI DES TRAVAUX D’EXTENSION DE (3) TROIS LYCEES QUALIFIANTS PAR 12 SALLES DE CLASSE REPARTIS COMME SUIT: (6) SIX SALLES AU LYCEE QUALIFIANT OULED HRIZ GHARBIA A LA COMUNE SOUALEM ET (4) QUATRE SALLES AU LYCEE QUALIFIANT LAGHNIMIINE A LA COMUNE TERRITORIALE LAGHNIMIINE ET 2 SALLES AU LYCEE QUALIFIANT HASSAN BNO TABIT A LA COMMUNE DE LAGHNIMMIINE RELEVANT DE LA DIRECTION PROVINCIALE DE BERRECHID; AREF CASA ASETTAT .,DIRECTION PROVINCIALE DE L’EDUCATION NATIONALE DE BERCHID,BERRECHID,2025-12-23,2026-02-09 10:00:00,,https://www.marchespublics.gov.ma/index.php?page=entreprise.EntrepriseDetailConsultation&refConsultation=966153&orgAcronyme=p8x,False,False,1,2500000.0
966156,p8x,6/DPB/2026,Consultation architecturale ouverte,CONSA,Services,LES ETUDES ARCHITECTURALES ET SUIVI DES TRAVAUX D’EXTENSION DE L’ÉCOLE PRIMAIRE AL QODS -( 4 SALLES) - ECOLE HAD SOUALEM ( 2 SALLES) À LA COMMUNE DE HAD SOUALEM - ÉCOLE CHOURAFAA ( 3 SALLES) À LA COMMUNE DE SIDI RAHAL CHATII ET ÉCOLE DEROUA JADIDA ( 3 SALLES À LA COMMUNE DE DEROUA RELEVANT DE LA DIRECTION PROVINCIALE DE BERRECHID - AREF CASA SETTAT,DIRECTION PROVINCIALE DE L’EDUCATION NATIONALE DE BERCHID,BERRECHID,2025-12-23,2026-02-09 11:00:00,,https://www.marchespublics.gov.ma/index.php?page=entreprise.EntrepriseDetailConsultation&refConsultation=966156&orgAcronyme=p8x,False,False,1,2500000.0
966199,f8y,17./2025,Appel d'offres ouvert,AOO,Travaux,"Travaux d’aménagement des espaces de jeux pour enfants et d’autre espaces de jeux sportifs A La Ville D’el Aioun Sidi Mellouk «Reserve T.P, PME,COOP,UCOOP,AE»",Commune urbaine de EL AIOUN SIDI MELLOUK,Province de Taourirt,2025-12-30,2026-01-21 10:00:00,,https://www.marchespublics.gov.ma/index.php?page=entreprise.EntrepriseDetailConsultation&refConsultation=966199&orgAcronyme=f8y,False,False,1,947274.0
966203,q9t,04/2026/CHUIS,Appel d'offres ouvert,AOO,Services,L’exécution des prestations d’accueil et d’assistance au niveau de l’Institut National d’Oncologie « Sidi Mohamed ben Abdellah » (INO) relevant du CHUIS,CENTRE HOSPITALIER UNIVERSITAIRE IBN SINA RABAT,Wilaya de Rabat,2025-12-24,2026-01-22 10:00:00,,https://www.marchespublics.gov.ma/index.php?page=entreprise.EntrepriseDetailConsultation&refConsultation=966203&orgAcronyme=q9t,False,False,1,332555568.0
966221,f8y,18/2025,Appel d'offres ouvert,AOO,Fournitures,"Acquisition et installation de jeux pour enfants et de jeux sportifs A La Ville D’el Aioun Sidi Mellouk(EN 02 projets) «Reserve T.P, PME, COOP, UCOOP, AE» Projet n° 1 : Acquisition et installation de jeux pour enfants Projet n°2 : Acquisition et installation de matériels sportifs",Commune urbaine de EL AIOUN SIDI MELLOUK,Province de Taourirt,2025-12-30,2026-01-21 12:00:00,,https://www.marchespublics.gov.ma/index.php?page=entreprise.EntrepriseDetailConsultation&refConsultation=966221&orgAcronyme=f8y,False,False,1,407160.0
966232,g3h,51/FA/DAAFL/DIV.GF/ZS/2025,Appel d'offres ouvert,AOO,Travaux,"Travaux d’aménagement et d’installation pour la mise en place d’un poste de transformateur et des équipements électriques à la caserne du 13°GMM Laâyoune, en lot unique.",INSPECTION GENERALE DES FORCES AUXILIAIRES - ZONE SUD,LAAYOUNE,2025-12-31,2026-01-22 10:00:00,,https://www.marchespublics.gov.ma/index.php?page=entreprise.EntrepriseDetailConsultation&refConsultation=966232&orgAcronyme=g3h,False,False,1,572820.0
966238,f8y,19/2025,Appel d'offres ouvert,AOO,Travaux,travaux de clôture des espaces de jeux pour enfants et d’autres espaces de jeux sportifs au boulevard birnzaran,Commune urbaine de EL AIOUN SIDI MELLOUK,Province de Taourirt,2025-12-30,2026-01-21 13:00:00,,https://www.marchespublics.gov.ma/index.php?page=entreprise.EntrepriseDetailConsultation&refConsultation=966238&orgAcronyme=f8y,False,False,1,386742.0
966250,g3h,563/2025/SRMCS,Appel d'offres ouvert,AOO,Fournitures,FOURNITURE DE DEBITMETRES ELECTROMAGNETIQUES SECTEUR SEPARE POUR EAU POTABLE,SOCIETE REGIONALE MULTISERVICES CASABLANCA - SETTAT SA,CASABLANCA,2025-12-24,2026-02-05 09:30:00,,https://www.marchespublics.gov.ma/index.php?page=entreprise.EntrepriseDetailConsultation&refConsultation=966250&orgAcronyme=g3h,False,False,1,3334652.0
966267,o8p,30/25,Appel d'offres ouvert,AOO,Fournitures,Air Conditioner Unit,RAM HANDLING,MAROC,2025-12-24,2026-01-29 17:00:00,,https://www.marchespublics.gov.ma/index.php?page=entreprise.EntrepriseDetailConsultation&refConsultation=966267&orgAcronyme=o8p,False,False,1,6157440.0
966272,f8y,20/2025,Appel d'offres ouvert,AOO,Travaux,"Travaux d’Aménagement des Ronds-points, Sur la Route National N°6 : 1ier Rond-point Près de La Commune Situé à l’Intersection Route Nationale N°:6 Et Route Tafoughalt ; 2ième Rond-point Situé à l’Intersection Route Nationale N°:6 Et Route Casa Vers Oujda ; 3ième Rond-point de l’Hôpital",Commune urbaine de EL AIOUN SIDI MELLOUK,Province de Taourirt,2025-12-30,2026-01-21 15:00:00,,https://www.marchespublics.gov.ma/index.php?page=entreprise.EntrepriseDetailConsultation&refConsultation=966272&orgAcronyme=f8y,False,False,1,1275840.0
966273,o8p,86/25/S,Appel d'offres ouvert,AOO,Fournitures,Acquisition des groupes électrogènes mobiles sur remorques pour les directions régionales d’ADM,AUTOROUTES DU MAROC,TANGER-ASSILAH,2025-12-24,2026-01-29 12:00:00,,https://www.marchespublics.gov.ma/index.php?page=entreprise.EntrepriseDetailConsultation&refConsultation=966273&orgAcronyme=o8p,False,False,1,3960000.0
966274,j8k,01/2025,Concours Architectural,CONCA,Services,LA CONCEPTION ET LE SUIVI DES TRAVAUX DE CONSTRUCTION DU STADE DE FOOTBALL DE NADOR A LA PROVINCE DE NADOR.,SOCIETE ALOMRANE REGION DE L’ORIENTAL,NADOR,2025-12-24,2026-02-03 10:00:00,,https://www.marchespublics.gov.ma/index.php?page=entreprise.EntrepriseDetailConsultation&refConsultation=966274&orgAcronyme=j8k,False,False,1,429600000.0
966301,q9t,18/2025/EST/DDT,Appel d'offres ouvert,AOO,Services,L’EXTERNALISATION DE PRESTATION DES AIDES SOIGNANTS POUR L’HOPITAL DES SPECIALITES DE TETOUAN RELEVANT DU DISTRICT SANITAIRE DE TETOUAN,ESPACE - DISTRICT SANITAIRE TETOUAN,TETOUAN,2025-12-24,2026-02-05 11:00:00,,https://www.marchespublics.gov.ma/index.php?page=entreprise.EntrepriseDetailConsultation&refConsultation=966301&orgAcronyme=q9t,False,False,1,12138587.13
966320,l1f,05/2025,Appel d'offres ouvert,AOO,Travaux,TRAVAUX D’AMENAGEMENT DU SOUK HEBDOMADAIRE DE LA COMMUNE TERRITORIALE MOKRISSET,Commune rurale de MOQRISSAT,OUEZZANE,2025-12-30,2026-01-28 10:00:00,,https://www.marchespublics.gov.ma/index.php?page=entreprise.EntrepriseDetailConsultation&refConsultation=966320&orgAcronyme=l1f,False,False,1,6793602.0
966363,g3h,515/2025/SRMCS,Appel d'offres ouvert,AOO,Travaux,"Réalisation des liaisons souterraines HTB 63kV entre les Postes Sources Oulad Haddou, Yacoub El Mansour et ADE (2 Lots)",SOCIETE REGIONALE MULTISERVICES CASABLANCA - SETTAT SA,CASABLANCA,2025-12-24,2026-02-04 14:00:00,,https://www.marchespublics.gov.ma/index.php?page=entreprise.EntrepriseDetailConsultation&refConsultation=966363&orgAcronyme=g3h,False,False,2,51122400.0
966375,o8p,AOO/99/ANEPCEST/2025,Appel d'offres ouvert,AOO,Travaux,"TRAVAUX DE CONSTRUCTION DU GRAND THEATRE DE FES - LOT N°2 – REVETEMENTS - FAUX PLAFOND – MENUISERIE ALUMINIUM – MENUISERIE BOIS, METALLIQUE - ELECTRICITE - PLOMBERIE – CLIMATISATION – VENTILATION– DESENFUMAGE-ASCENSEUR – AMENAGEMENT EXTERIEUR",DIRECTION REGIONALE DE L'AGENCE NATIONALE DES EQUIPEMENTS PUBLICS DU CENTRE EST,FES,2025-12-25,2026-01-30 10:00:00,,https://www.marchespublics.gov.ma/index.php?page=entreprise.EntrepriseDetailConsultation&refConsultation=966375&orgAcronyme=o8p,False,False,1,46576992.0
966383,o8p,27/2025/AMDL,Appel d'offres ouvert,AOO,Travaux,DEVIATION DE LA LIGNE 60 KV N°321 LAAWAMAR – AEROPORT MOHAMED V A LA TRAVERSEE DE LA ZONE LOGISTQIUE OULED SALEH A LA COMMUNE OULED SALEH - PROVINCE DE NOUACEUR,AGENCE MAROCAINE DE DEVELOPPEMENT DE LA LOGISTIQUE,NOUACEUR,2025-12-24,2026-01-22 10:30:00,,https://www.marchespublics.gov.ma/index.php?page=entreprise.EntrepriseDetailConsultation&refConsultation=966383&orgAcronyme=o8p,False,False,1,3625356.0
966384,o8p,52/MPS/2025/ANEPMS,Consultation architecturale ouverte,CONSA,Services,LA CONCEPTION ARCHITECTURALE ET LE SUIVI DES TRAVAUX DE RECONSTRUCTION DU CENTRE DE SANTE URBAIN NIVEAU 2 (CSU-2) SIDI REHAL-PROVINCE EL KELAA DES SRAGHNA.,DIRECTION REGIONALE DE L'AGENCE NATIONALE DES EQUIPEMENTS PUBLICS DE MARRAKECH - SAFI,EL KELAA DES SRAGHNA,2025-12-31,2026-01-22 10:00:00,,https://www.marchespublics.gov.ma/index.php?page=entreprise.EntrepriseDetailConsultation&refConsultation=966384&orgAcronyme=o8p,False,False,1,6024000.0
966405,g8e,50/2025/DGI,Consultation architecturale ouverte,CONSA,Services,l’étude architecturale et le suivi des travaux d’aménagement du siège DATALAB de la Direction Générale des Impôts,DIRECTEUR DES IMPOTS -RABAT,RABAT,2025-12-25,2026-02-05 10:00:00,,https://www.marchespublics.gov.ma/index.php?page=entreprise.EntrepriseDetailConsultation&refConsultation=966405&orgAcronyme=g8e,False,False,1,2400000.0
966418,j8k,153/25,Appel d'offres ouvert,AOO,Travaux,"TRAVAUX DE VOIRIE, ASSAINISSEMENT, EAU POTABLE DU PROJET « OASIS CITY » SIS A LA PREFECTURE D'ARRONDISSEMENT DE CASA-ANFA",SOCIETE AL OMRANE CASABLANCA,MAROC,2025-12-24,2026-01-29 10:00:00,,https://www.marchespublics.gov.ma/index.php?page=entreprise.EntrepriseDetailConsultation&refConsultation=966418&orgAcronyme=j8k,False,False,1,27161763.73
966424,g3h,548/2025/SRMCS,Appel d'offres ouvert,AOO,Fournitures,Rééquipement des stations de reprise au niveau des communes territoriales relevant de la Province de Benslimane,SOCIETE REGIONALE MULTISERVICES CASABLANCA - SETTAT SA,BENSLIMANE,2025-12-25,2026-01-27 14:30:00,,https://www.marchespublics.gov.ma/index.php?page=entreprise.EntrepriseDetailConsultation&refConsultation=966424&orgAcronyme=g3h,False,False,1,1200000.0
966426,s3d,39/2025/SONARGES,Appel d'offres ouvert,AOO,Services,ELABORATION DES ETUDES DE SECURITE INCENDIE ET COORDINATION DU SYSTEME DE SECURITE INCENDIE DU PROJET DE MISE A NIVEAU DU COMPLEXE SPORTIF AL AMAL CASABLANCA,SOCIETE NATIONALE DE REALISATION ET DE GESTION DES ÉQUIPEMENTS SPORTIFS,CASABLANCA,2025-12-24,2026-02-05 12:00:00,,https://www.marchespublics.gov.ma/index.php?page=entreprise.EntrepriseDetailConsultation&refConsultation=966426&orgAcronyme=s3d,False,False,1,450000.0
966427,s3d,40/2025/SONARGES,Appel d'offres ouvert,AOO,Services,"ELABORATION DES ETUDES TECHNIQUES, ORDONNANCEMENT, PILOTAGE ET LE SUIVI DES TRAVAUX DE MISE A NIVEAU DU COMPLEXE SPORTIF AL-AMAL",SOCIETE NATIONALE DE REALISATION ET DE GESTION DES ÉQUIPEMENTS SPORTIFS,CASABLANCA,2025-12-24,2026-02-05 11:00:00,,https://www.marchespublics.gov.ma/index.php?page=entreprise.EntrepriseDetailConsultation&refConsultation=966427&orgAcronyme=s3d,False,False,1,2800000.0
966438,d0q,7/2025,Appel d'offres ouvert,AOO,Services,la location de deux locaux commerciaux relevant du patrimoine de la commune de BNI BOUCHIBET – province al Hoceima,Commune BNI BOUCHIBET,AL HOCEIMA,2025-12-30,2026-01-27 11:00:00,,https://www.marchespublics.gov.ma/index.php?page=entreprise.EntrepriseDetailConsultation&refConsultation=966438&orgAcronyme=d0q,False,False,2,1000.0
966446,d4q,TS3129744/2025/30/ONEEBELEC,Appel d'offres ouvert,AOO,Travaux,Mise en place des miradors au poste 225/60 KV OULED RAHOU.,OFFICE NATIONALE DE L'ELECTRICITE ET DE L'EAU POTABLE - BRANCHE ELECTRICITE,TAROUDANNT,2025-12-25,2026-02-10 09:00:00,,https://www.marchespublics.gov.ma/index.php?page=entreprise.EntrepriseDetailConsultation&refConsultation=966446&orgAcronyme=d4q,False,False,1,1972400.0
966447,a1t,23/2026/APDN,Appel d'offres ouvert,AOO,Travaux,Travaux de construction de deux (02) classes de préscolaire à la commune d’al Hoceima,AGENCE POUR LA PROMOTION ET LE DEVELOPPEMENT ECONOMIQUE ET SOCIAL DES PREFECTURES ET PROVINCES DU NORD DU ROYAUME,AL HOCEIMA,2025-12-25,2026-01-21 10:00:00,,https://www.marchespublics.gov.ma/index.php?page=entreprise.EntrepriseDetailConsultation&refConsultation=966447&orgAcronyme=a1t,False,False,1,502437.6
966449,a1t,02/2026/APDN,Appel d'offres ouvert,AOO,Travaux,Travaux d'aménagement de pistes aux niveaux de la commune Sidi Ahmed Cherif - Province d’Ouezzane,AGENCE POUR LA PROMOTION ET LE DEVELOPPEMENT ECONOMIQUE ET SOCIAL DES PREFECTURES ET PROVINCES DU NORD DU ROYAUME,OUEZZANE,2025-12-25,2026-01-22 10:00:00,,https://www.marchespublics.gov.ma/index.php?page=entreprise.EntrepriseDetailConsultation&refConsultation=966449&orgAcronyme=a1t,False,False,1,1403478.0
966452,a1t,03/2026/apdn,Appel d'offres ouvert,AOO,Travaux,Travaux d'aménagement de pistes au niveau de la commune de Zghira – Province d’Ouezzane,AGENCE POUR LA PROMOTION ET LE DEVELOPPEMENT ECONOMIQUE ET SOCIAL DES PREFECTURES ET PROVINCES DU NORD DU ROYAUME,OUEZZANE,2025-12-25,2026-01-22 11:00:00,,https://www.marchespublics.gov.ma/index.php?page=entreprise.EntrepriseDetailConsultation&refConsultation=966452&orgAcronyme=a1t,False,False,1,1297124.52
966455,o8p,25T074/PLGV,Appel d'offres ouvert,AOO,Travaux,"Travaux de déviation et de renforcement du pipeline14’’, et des réserves de la SAMIR impactés par le projet de Ligne à Grande Vitesse Kenitra – Marrakech",OFFICE NATIONAL DES CHEMINS DE FER,CASABLANCA,2025-12-25,2026-02-05 09:00:00,,https://www.marchespublics.gov.ma/index.php?page=entreprise.EntrepriseDetailConsultation&refConsultation=966455&orgAcronyme=o8p,False,False,1,44814000.0
966463,g3h,543/2025/SRMCS,Appel d'offres ouvert,AOO,Fournitures,MARCHE CADRE FOURNITURE D'ACCESSOIRES DE RACCORDEMENT D’EAU POTABLE,SOCIETE REGIONALE MULTISERVICES CASABLANCA - SETTAT SA,CASABLANCA,2025-12-25,2026-01-30 09:30:00,,https://www.marchespublics.gov.ma/index.php?page=entreprise.EntrepriseDetailConsultation&refConsultation=966463&orgAcronyme=g3h,False,False,3,4048664.4
966472,d4q,49/DAM/S/2025,Appel d'offres ouvert,AOO,Fournitures,MISE À NIVEAU ET MAINTENANCE DE LA SOLUTION DE CENTRALISATION ET GESTION DES LOGS (SIEM),OFFICE NATIONAL DE L'ELECTRICITE ET DE L'EAU POTABLE - BRANCHE EAU,RABAT,2025-12-26,2026-02-03 10:30:00,,https://www.marchespublics.gov.ma/index.php?page=entreprise.EntrepriseDetailConsultation&refConsultation=966472&orgAcronyme=d4q,False,False,1,7200000.0
966489,g3h,528/2025/SRMCS,Appel d'offres ouvert,AOO,Fournitures,Fourniture et pose d’articles de menuiserie métallique pour un poste de distribution publique et une cabine mobile,SOCIETE REGIONALE MULTISERVICES CASABLANCA - SETTAT SA,CASABLANCA,2025-12-25,2026-01-28 09:30:00,,https://www.marchespublics.gov.ma/index.php?page=entreprise.EntrepriseDetailConsultation&refConsultation=966489&orgAcronyme=g3h,False,False,1,3877200.0
966498,j8k,43/2025/HAO,Appel d'offres ouvert,AOO,Services,la revue de la stratégie RSE du Groupe Al-Omrane.,HOLDING AL OMRANE,RABAT,2025-12-25,2026-01-22 10:00:00,,https://www.marchespublics.gov.ma/index.php?page=entreprise.EntrepriseDetailConsultation&refConsultation=966498&orgAcronyme=j8k,False,False,1,600000.0
966522,g3h,518/2025/SRMCS,Appel d'offres ouvert,AOO,Services,Contrôle non destructif de la stabilité des candélabres d’éclairage public,SOCIETE REGIONALE MULTISERVICES CASABLANCA - SETTAT SA,CASABLANCA,2025-12-25,2026-01-27 09:30:00,,https://www.marchespublics.gov.ma/index.php?page=entreprise.EntrepriseDetailConsultation&refConsultation=966522&orgAcronyme=g3h,False,False,1,825000.0
966536,z9k,25/2025/BP/PAZ,Appel d'offres ouvert,AOO,Services,"* Réalisation des études géotechniques et essais de contrôle et suivi de la qualité des travaux de : - Construction d’un ouvrage d’art sur oued Lakhdar au PK 27+950 de la route non classée reliant centre Ouaoula et RR 302 passant par Tisquima-Idamaghen-Togado à la C.T Ouaoula, province d’Azilal. - Construction de la route non classée reliant centre Ouaoula et RR 302 passant par Tisquima- Idamaghen-Togado du PK 21+000 au PK 32+000 à la C.T Ouaoula , province d’Azilal.",LE CONSEIL PROVINCIAL D'AZILAL,AZILAL,2025-12-25,2026-01-29 10:00:00,,https://www.marchespublics.gov.ma/index.php?page=entreprise.EntrepriseDetailConsultation&refConsultation=966536&orgAcronyme=z9k,False,False,1,127104.0
966550,f4g,27/DRAI/BK/BG/2025,Appel d'offres ouvert,AOO,Travaux,"TRAVAUX DE CONSTRUCTION DE 06 SALLES D’ENSEIGNEMENT ET D’UN LOGEMENT DE FONCTION À L’ECOLE CHEIKH MOHAMMED AL MOATA BEN SALEH CHARKI SISE BEJAAD, A LA PROVINCE DE KHOURIBGA",DELEGUE REGIONAL DES AFFAIRES ISLAMIQUES DE LA REGION BENIMELLAL-KHENIFRA,KHOURIBGA,2025-12-31,2026-02-10 10:00:00,,https://www.marchespublics.gov.ma/index.php?page=entreprise.EntrepriseDetailConsultation&refConsultation=966550&orgAcronyme=f4g,False,False,1,2922852.49
966556,p1v,01/2026,Appel d'offres ouvert,AOO,Travaux,TRAVAUX D’AMENAGEMENT D’UN TERRAIN DE PROXIMITE A LA COMMUNE OULED HAMDANE - PROVINCE EL JADIDA,Commune rurale de OULAD HAMDANE,EL JADIDA,2025-12-25,2026-01-28 11:00:00,,https://www.marchespublics.gov.ma/index.php?page=entreprise.EntrepriseDetailConsultation&refConsultation=966556&orgAcronyme=p1v,False,False,1,554950.8
966566,f4g,28/DRAI/BK/BG/2025,Appel d'offres ouvert,AOO,Services,"LA RECEPTION DES FONDS DE FOUILLES, SUIVI ET CONTROLE DE QUALITE DES TRAVAUX DE CONSTRUCTION DE 06 SALLES D’ENSEIGNEMENT ET D’UN LOGEMENT DE FONCTION À L’ECOLE CHEIKH MOHAMMED AL MOATA BEN SALEH CHARKI SISE BEJAAD, A LA PROVINCE DE KHOURIBGA",DELEGUE REGIONAL DES AFFAIRES ISLAMIQUES DE LA REGION BENIMELLAL-KHENIFRA,KHOURIBGA,2025-12-31,2026-02-17 10:00:00,,https://www.marchespublics.gov.ma/index.php?page=entreprise.EntrepriseDetailConsultation&refConsultation=966566&orgAcronyme=f4g,False,False,1,56340.0
966571,g3h,60/2025/PN,Appel d'offres ouvert,AOO,Fournitures,l’achat du petit matériel des travaux publics et d’habillement destinés à la réalisation du barrage kourayzen dans la province de Tiznit.,GOUVERNEUR DE LA PROVINCE DE TIZNIT,TIZNIT,2025-12-31,2026-01-26 10:00:00,,https://www.marchespublics.gov.ma/index.php?page=entreprise.EntrepriseDetailConsultation&refConsultation=966571&orgAcronyme=g3h,False,False,1,1001748.0
966576,g3h,10004711,Appel d'offres ouvert,AOO,Services,ASSISTANCE TECHNIQUE ET SUIVI DES TRAVAUX DE CONSTRUCTION DE RESERVOIR 2500M3 SISE AU NIVEAU DE LA COMMUNE DE SELOUANE,SOCIETE REGIONALE MULTISERVICES DE L'ORIENTAL S.A,NADOR,2025-12-30,2026-01-27 10:30:00,,https://www.marchespublics.gov.ma/index.php?page=entreprise.EntrepriseDetailConsultation&refConsultation=966576&orgAcronyme=g3h,False,False,1,840000.0
966585,o3f,AOO066/SMIT/2025,Appel d'offres ouvert,AOO,Travaux,TRAVAUX D’AMENAGEMENT ET DE VALORISATION TOURISTIQUE DES GORGES DE TODGHA - PROVINCE DE TINGHIR TRANCHE 01 – AMENAGEMENTS EXTERIEURS,SOCIETE MAROCAINE D'INGENIERIE TOURISTIQUE,TINGHIR,2025-12-25,2026-01-22 10:00:00,,https://www.marchespublics.gov.ma/index.php?page=entreprise.EntrepriseDetailConsultation&refConsultation=966585&orgAcronyme=o3f,False,False,1,20125866.0
966592,g3h,017/2025,Appel d'offres ouvert,AOO,Fournitures,ACQUISITION DES BULBES DE SAFRAN AU PROFIT DE CERTAINES COOPERATIVES AGRICOLES RELEVANT DES COLLECTIVITES ETHNIQUE AIT AAMAR ET TAMASSINE AUX COMMUNES TERRITORIALES D’OUISSALSATE ET SIROUA PROVINCE D’OUARZAZATE,GOUVERNEUR DE OUARZAZATE,OUARZAZATE,2025-12-25,2026-01-21 11:00:00,,https://www.marchespublics.gov.ma/index.php?page=entreprise.EntrepriseDetailConsultation&refConsultation=966592&orgAcronyme=g3h,False,False,1,965250.0
966593,g3h,10004532,Appel d'offres ouvert,AOO,Travaux,TRAVAUX DE RECHERCHE ET REPARATION DE FUITES AU NIVEAU DES GERANCES URBAINES RELEVANT DE LA DP DE NADOR,SOCIETE REGIONALE MULTISERVICES DE L'ORIENTAL S.A,NADOR,2025-12-30,2026-01-27 10:45:00,,https://www.marchespublics.gov.ma/index.php?page=entreprise.EntrepriseDetailConsultation&refConsultation=966593&orgAcronyme=g3h,False,False,1,1912200.0
966614,q9t,AO78/2025,Appel d'offres ouvert,AOO,Services,MISSION D’ACCOMPAGNEMENT À L'ACCRÉDITATION ISO 15189 : 2022 DU CENTRE DE TUBERCULOSE AU PROFIT DE L’INSTITUT PASTEUR DU MAROC (IPM).,INSTITUT PASTEUR DU MAROC,Wialaya de Casablanca Anfa,2025-12-25,2026-01-21 10:00:00,,https://www.marchespublics.gov.ma/index.php?page=entreprise.EntrepriseDetailConsultation&refConsultation=966614&orgAcronyme=q9t,False,False,1,500400.0
966631,j0w,CTZ/BC/2025/11,Appel d'offres ouvert,AOO,Travaux,TRAVAUX DE CONSTRUCTION D’UN STADE DE FOOTBALL AU CENTRE ZERKTEN PROVINCE AL HAOUZ REGION MARRAKECH-SAFI,Commune ZERKTEN,AL HAOUZ,2025-12-25,2026-01-22 11:00:00,,https://www.marchespublics.gov.ma/index.php?page=entreprise.EntrepriseDetailConsultation&refConsultation=966631&orgAcronyme=j0w,False,False,1,4382823.84
966643,d4q,40/2025/DR4,Appel d'offres ouvert,AOO,Travaux,"Renforcement de l'alimentation en eau potable de la commune Sfassif relevant de la Province de Khemisset à partir du barrage Idriss 1er, lot Unique.",OFFICE NATIONAL DE L'ELECTRICITE ET DE L'EAU POTABLE - BRANCHE EAU,KHEMISSET,2025-12-29,2026-01-27 09:00:00,,https://www.marchespublics.gov.ma/index.php?page=entreprise.EntrepriseDetailConsultation&refConsultation=966643&orgAcronyme=d4q,False,False,1,10499970.0
966667,g3h,486/2025/SRMCS,Appel d'offres ouvert,AOO,Fournitures,"Marché Cadre : Fourniture de tableaux, fusibles BT et accessoires pour l’éclairage public",SOCIETE REGIONALE MULTISERVICES CASABLANCA - SETTAT SA,CASABLANCA,2025-12-26,2026-02-02 09:30:00,,https://www.marchespublics.gov.ma/index.php?page=entreprise.EntrepriseDetailConsultation&refConsultation=966667&orgAcronyme=g3h,False,False,2,2674980.0
966677,g3h,527/2025/SRMCS,Appel d'offres ouvert,AOO,Services,Accompagnement à la mise en place du dispositif de contrôle interne de la SRM-Casablanca Settat,SOCIETE REGIONALE MULTISERVICES CASABLANCA - SETTAT SA,CASABLANCA,2025-12-25,2026-01-23 09:30:00,,https://www.marchespublics.gov.ma/index.php?page=entreprise.EntrepriseDetailConsultation&refConsultation=966677&orgAcronyme=g3h,False,False,1,840000.0
966700,g3h,558/2025/SRMCS,Appel d'offres ouvert,AOO,Travaux,Travaux d’aménagement des postes sources et répartiteurs pour le compte de la SRM-Casablanca Settat,SOCIETE REGIONALE MULTISERVICES CASABLANCA - SETTAT SA,NOUACEUR,2025-12-26,2026-01-29 09:30:00,,https://www.marchespublics.gov.ma/index.php?page=entreprise.EntrepriseDetailConsultation&refConsultation=966700&orgAcronyme=g3h,False,False,2,4977648.0
966714,d4q,81DR3/2025,Appel d'offres ouvert,AOO,Services,Mise à disposition du personnel d'intérim au niveau de la Direction Régionale de Production Béni Mellal-Khénifra,OFFICE NATIONAL DE L'ELECTRICITE ET DE L'EAU POTABLE - BRANCHE EAU,BENI MELLAL,2025-12-26,2026-02-05 10:00:00,,https://www.marchespublics.gov.ma/index.php?page=entreprise.EntrepriseDetailConsultation&refConsultation=966714&orgAcronyme=d4q,False,False,1,295000.0
966743,a2a,01/2025/DRPE,Appel à manifestation d'intérêt,AMI,Services,"Etude de collecte des eaux pluviales intégrant des solutions fondées sur la nature (SFN) à Rabat, Salé, Temara et Skhirate",DIRECTEUR DE LA RECHERCHE ET DE LA PLANIFICATION DE L'EAU,RABAT,2025-12-26,2026-02-16 11:00:00,,https://www.marchespublics.gov.ma/index.php?page=entreprise.EntrepriseDetailConsultation&refConsultation=966743&orgAcronyme=a2a,False,False,1,3000000.0
966755,d4q,106DR1/CI/2025,Appel d'offres ouvert,AOO,Fournitures,Acquisition des équipements électriques MT et pièces de rechange pour les installations de la Direction Régionale de Production Souss Massa,OFFICE NATIONAL DE L'ELECTRICITE ET DE L'EAU POTABLE - BRANCHE EAU,AGADIR IDA OU TANANE,2025-12-26,2026-02-16 10:00:00,,https://www.marchespublics.gov.ma/index.php?page=entreprise.EntrepriseDetailConsultation&refConsultation=966755&orgAcronyme=d4q,False,False,1,2400000.0
966781,g3h,121/2025/E,Appel d'offres ouvert,AOO,Travaux,TRAVAUX D’EQUIPEMENTS ELECTRIQUES DES POSTES HTA/BT DE DISTRIBUTION PUBLIQUE AO EN DEUX LOTS IDENTIQUES (SUR PROPOSITION DU COEFFICIENT MULTIPLICATEUR) (MARCHE CADRE).,REDAL,RABAT,2025-12-26,2026-02-04 10:00:00,,https://www.marchespublics.gov.ma/index.php?page=entreprise.EntrepriseDetailConsultation&refConsultation=966781&orgAcronyme=g3h,False,False,1,20075088.0
966785,g3h,479/2025/SRMCS,Appel d'offres ouvert,AOO,Services,Prestation d’Edition des factures au profit des directions provinciale et préfectorale de la SRM-CS,SOCIETE REGIONALE MULTISERVICES CASABLANCA - SETTAT SA,CASABLANCA,2025-12-26,2026-01-23 09:30:00,,https://www.marchespublics.gov.ma/index.php?page=entreprise.EntrepriseDetailConsultation&refConsultation=966785&orgAcronyme=g3h,False,False,9,10906495.2
966806,q1s,06/2026/ORTAF,Appel d'offres ouvert,AOO,Travaux,Travaux d'aménagement et de construction des pistes agricoles dans le cadre du PADIDZAR : Aménagement pistes dans la zone de Goulmima,OFFICE REGIONAL DE MISE EN VALEUR AGRICOLE DE TAFILALET,ERRACHIDIA,2025-12-26,2026-02-05 10:30:00,,https://www.marchespublics.gov.ma/index.php?page=entreprise.EntrepriseDetailConsultation&refConsultation=966806&orgAcronyme=q1s,False,False,1,2132239.2
